doc021,21,Protocolo Homologado para la Búsqueda de Personas Desaparecidas y No Localizadas,Herramientas para la búsqueda,Protocolo,Recurso legal para personas buscadoras,Comisión Nacional de Búsqueda y USAID,2021,Protocolo que destaca las obligaciones que las diferentes autoridades tienen en la búsqueda de las personas desaparecidas.,Protocol highlighting the obligations that different authorities have during the search for the disappeared.,https://comisionnacionaldebusqueda.com/protocolo-homologado-de-busqueda/,,Documento público,Camila,N/A,Not needed,,,"Luego de un proceso ampliamente participativo en el que participaron familiares de personas desaparecidas, representantes y personas expertas nacionales e internacionales, así como diversas autoridades federales y estatales, el Sistema Nacional de Búsqueda aprobó, por mayoría, el Protocolo Homologado para la Búsqueda de Personas Desparecidas y No Localizadas (PHB), el cual fue publicado el 6 de octubre de 2020, y destaca las obligaciones que las diferentes autoridades tienen en la búsqueda de las personas desaparecidas. El PHB entró en vigor el 6 de enero de 2021. La Comisión de Implementación, Monitoreo, Evaluación y Actualización del PHB ha sesionado constantemente para avanzar en la implementación del mismo. Además, se han llevado a cabo capacitaciones a personal de la CNB, Comisiones Locales de Búsqueda y a familiares de personas desaparecidas y representantes, policías y personal ministerial. Asimismo, se elaboró y aprobó la versión resumida del PHB para familiares."
doc022,22,Nos llaman las locas de las palas. El papel de las mujeres en la búsqueda de sus familiares desaparecidos,Voces desde la búsqueda,Testimonios e historias de búsqueda de mujeres buscadoras,Recopilación de testimonios sobre la búsqueda de personas para personas buscadoras y sensibilización de autoridades,Centro Prodh,2020,"Testimonios de 9 mujeres buscadoras describiendo las consecuencias económicas, físicas y psicológicas detonadas por la desaparición de sus familiares.","Testimonies of 9 women who search describing the economic, physical and psychological consequences triggered by the disappearance of their relatives.",https://centroprodh.org.mx/2020/05/10/pub-las-locas-de-las-palas/,,Meyatzin Velasco Santiago: educacion2@centroprodh.org.mx,Camila,Approved,Yes,,,"Al igual que durante las décadas de los sesenta a los ochenta del siglo pasado, la impunidad de las desapariciones ha sido enfrentada primordialmente por la resiliencia y la fuerza de las familias de las víctimas. A través de la organización en colectivos, la movilización, la búsqueda directa y la incidencia política, las familias han reconfigurado tanto el mapa de la sociedad civil organizada como la caracterización de las víctimas de violaciones a derechos humanos, han logrado que su voz se escuche y han señalado los puntos álgidos de la situación. Dentro del movimiento de familiares, las mujeres juegan el papel principal. Desde el Centro Prodh nos dimos a la tarea de entrevistar a nueve de ellas para conocer su experiencia ante el aparato de justicia, las consecuencias económicas, físicas y sicológicas que les ha traído la desaparición y la búsqueda y su papel como sujetas políticas. Los hallazgos, si bien no pueden ser tomados como un estudio sociológico –este material fue planteado como un reportaje– sí nos permiten a las organizaciones acompañantes, a la sociedad en general y al mismo movimiento de familias comenzar a dimensionar los impactos en las mujeres que buscan a quienes nos faltan a todos, apreciar el trabajo que hacen e imaginar formas de solidaridad con ellas y sus colectivos."
doc023,23,Nadie detiene el amor: historia de vida de familiares de personas desaparecidas en el Norte de Sinaloa,Voces desde la búsqueda,Testimonios e historias de búsqueda de buscadoras de Sinaloa,Recopilación de testimonios sobre la búsqueda de personas para personas buscadoras y sensibilización de autoridades,"Universidad Nacional Autónoma de México, Instituto de Investigaciones Jurídicas, GIASF, CIESAS, Hermanas en la Sombra, Buscadoras del Fuerte, Rastreadoras Fe y Esperanza y FUNDAR ",2020,Veinte historias que documentan las dificultades a las que se enfrentan las familias mientras buscan a sus seres queridos desaparecidos en Sinaloa.,Twenty stories capturing the hardships and conditions that families face while searching for their disappeared loved ones in Sinaloa.,https://www.giasf.org/publicaciones-del-giasf.html,,Carolina Robledo: carolina.robledo@ciesas.edu.mx o May-ek Querales: mayekerales@gmail.com,Jonathan,Approved ,Yes,,,"Después de un trabajo colaborativo de tres años, el GIASF publica junto a las buscadoras del Norte de Sinaloa, el Instituto de Investigaciones Jurídicas de la UNAM, el CIESAS, FUNDAR y la colectiva Hermanas en la Sombra, el libro ""Nadie detiene el amor: historia de vida de familiares de personas desaparecidas en el Norte de Sinaloa"" (2020). Los veinte relatos que compila este libro son el resultado de un trabajo de reflexión en torno a las condiciones históricas en que las y los buscadores sostienen sus vidas y las de sus familias. Narrativas que evocan formas de violencia y de resistencia continúas y marcadas por la diferenciación de género, edad, etnicidad y clase. A través del método de historias de vida, este libro pretende contribuir a la comprensión de la experiencia de la desaparición de personas ubicando la mirada más allá del acontecimiento violento."
doc024,24,Tinta para la memoria,Voces desde la búsqueda,Testimonios e historias de búsqueda de Veracruz,Recopilación de testimonios sobre la búsqueda de personas para personas buscadoras y sensibilización de autoridades,Fundación Heinrich Boll,2020,Una colección de testimonios que describen las huellas afectivas que sobreviven de las víctimas de desaparición en varias regiones de Veracruz.,A collection of testimonies describing the affective traces left behind by victims of disappearance in various regions of Veracruz.,https://mx.boell.org/es/2021/03/03/tinta-para-la-memoria,,mx-info@mx.boell.org,Jonathan,Approved ,Yes,,,"Este libro es producto de un acto de amor hacia las personas desaparecidas en el estado de Veracruz, un homenaje a sus vidas, al cariño que ofrecieron a sus familiares y amigos. Las personas que hoy les buscan desean tener una memoria impresa que dé cuenta de sus seres queridos, para darla a conocer a la sociedad en la que viven. Vale la pena recordar que estos hombres y mujeres desaparecidos y sus familiares son parte fundamental de nuestro país. Tinta para la memoria acoge siete relatos de personas que están desaparecidas desde hace tiempo, además de doce cartas y dos poemas que padres, hermanos e hijos escribieron para los seres que no están hoy con ellos. Los escritos que se presentan corresponden a 19 personas víctimas de desaparición en diversos municipios del estado de Veracruz entre 2010 y 2018. Seis de los siete relatos que abren este libro son fruto de entrevistas realizadas entre 2018 y 2019 con integrantes del grupo Buscando a nuestros desaparecidos y desaparecidas Veracruz, por la verdad y la justicia. El séptimo es un escrito biográfico sobre un maestro también desaparecido en el estado."
doc025,25,Memoria de un Corazón Ausente. Historias de Vida,Voces desde la búsqueda,Testimonios e historias de búsqueda de Coahuila,Recopilación de testimonios sobre la búsqueda de personas para personas buscadoras y sensibilización de autoridades,Fundación Heinrich Boll,2018,"Historias de vida de personas desaparecidas narradas por medio del trabajo de memoria de buscadoras, madres, esposas y hermanas en Coahuila.","Life histories of the disappeared as told through the memory work done by searching mothers, wives and sisters in Coahuila.",https://mx.boell.org/es/2018/05/09/memoria-de-un-corazon-ausente-historias-de-vida,,mx-info@mx.boell.org,Jonathan,Approved ,Yes,,,"Memoria de un corazón ausente. Historias de vida, es el resultado de un trabajo de recuperación de memoria que se realizó con doce mujeres que son madres, esposas y hermanas de personas desaparecidas en el estado de Coahuila. A la desaparición de una persona le sigue el que su vida se reduzca a ser una persona desaparecida. Con Memoria de un Corazón Ausente nos proponemos cambiar esta narrativa, resignificando la historia de personas desaparecidas en la voz de las mujeres que compartieron su cotidianeidad, a la luz del concepto búsqueda de vida."
doc026,26,No hay lugar en este país,Voces desde la búsqueda,Testimonios e historias de búsqueda de 13 familares,Recopilación de testimonios sobre la búsqueda de personas para personas buscadoras y sensibilización de autoridades,Fundar. Centro de Análisis e Investigación,2021,Narradas tras la desaparición 13 historias son testimonio de comunidades emergentes que comparten dolor y fuerza colectiva a través de la búsqueda.,"Told in the aftermath of disappearance, 13 stories act as testimony to emerging communities that share grief and collective strength through the search.",https://nohaylugarenestepais.mx/,,"Mariana Gurrola, Comunicación Fundar. comunicacion@fundar.org.mx",Jonathan,Approved,Yes,,,"13 autoras y autores, familiares de personas desaparecidas desafían el silenciamiento y abren espacio para escribir la narrativa desde sus voces. Las y los autores del libro “No hay lugar en este país” cuentan sobre la herida de la desaparición que abre un abismo, un antes y un después. El después de la guerra que penetra en las casas, rompe, arranca, y fractura. La desesperación y el tiempo que, detenido, parece una eternidad frente a la indolencia de quien no quiere recibir una denuncia porque está por acabar su turno. En estos relatos la crueldad se multiplica disfrazada de trámites burocráticos, oficios, diligencias mal hechas, restos humanos en bolsas de plástico. En “No hay lugar en este país” descubrimos historias habitadas por la esperanza de quienes han aprendido a vivir y a caminar de la mano, del amor inconmensurable de quien toma una pala para buscar y enterrar dignamente a las hijas y los hijos de este país herido."
doc027,27,¿Qué hacer frente a la desaparición de una persona?,Herramientas para la búsqueda,"Guía de Búsqueda, primeras horas",Recurso para colectivos y personas buscadoras,i(dh)eas,2021,"Guía que busca brindar información ágil, concreta y oportuna para las familias en la búsqueda de sus familiares desaparecidos.","Guide that seeks to provide agile, concrete and timely information for families in the search for their missing relatives.",https://www.idheas.org.mx/publicaciones-idheas/guia-que-hacer-frente-a-la-desaparicion-de-una-persona/,,,Monica,Approved,,,,